800019A	Font Details of Report Header Line#7	RPTPgHdr7Font
800019B	Font Details of PageNo,PrintDate,ShoperDate	RPTPgHdr8Font
800020A	Print Report Generation Date	RPTPrintDates
800021	General Discount Reason Configuration in Billing	GenDiscReasonOpt
800022	General Discount Activation Option(s) And  Value Type(s) In Billing	GenDiscActOptAndValType
800022A	Customer Mandatory in Cash Payouts / Receipts	DispCustomerFldCashRcptsPayouts
800023	Discount Configuration in Billing	ShowAllDiscounts
800024	Pricing Master Import/Export Key Match	PMKeyMatch
800025	Auto Price Revision Update	AutoPriceRevisionUpdate
800026	In PO Details Report Which Qty Fields To Show	InPORptWhichQtyFldsToShow
800027	Accepting Customer In Expected Tranactions	AcceptCustInReCall
800028	Print Expected Transactions in Condensed Mode	PrintReCallTrnInCondensedMode
800029	Print Discount Percentage and Amount In Header	PrintDiscPercAndAmt
800030	Print Raymond Shop Number	PrintRaymondShopNo
800031	Apply LSQ For Line Item Calculation In Billing	ApplyLSQForLineItemCal
800031A	Print Classification Code/ Description in Qlty Field	PrintClassificationCodeDescInQltyFld
800032	Calculate General Discount on Specified Value Rather Than Bill Value	ApplyGenDiscOnSpfdVal
800033	Number of Blank Lines to be Printed at End of Slip Printing	NoOfBlankLinesInSlips
800034	Num Of Records Reserved For Last Piece Disc(Item Spc Disc) In SF Table	MaxRecForLPDInSFTable
800036	Year Opening Date	YOPDate
800037	Promt Error Message In Billing Updation	PromtErrMsgInBillingUpd
800037A	Whether Computed Cost to be Edited in Pricing Master	WhetherCompCostEditPricingMaster
800038	Default Payment Mode in Billing (Payment Details Frame)	DefaultPayModeInBilling
800039	Show Expected Transaction Title in Report	ShowExptTrnTitleReport
800040	Whether to Display Sales Person Code or Job Worker Code	WhetherDisplaySalePersonCdOrTailorCd
800041	Selective Updation of Price Revision	SelectiveUpdatePriceRevision
800042	Print Small Credit Note In Any Stationery	PrintSmallCreditNote
800043	Goods Outwards Audit Trail Footer Details	GORAuditTrailFooterDtls
900000	Week Starting Information	WeekStartDate
B45-0601-0000144	Include All Receipt Reasons	IncludeAllRcptReasons
B61-0700-0000122	Print Discount Percentage/Amount And VAT Details	PrnDiscPercAmtAndVATDetails
B64-0601-0000005	Luxury Tax Calculation	LuxuryTaxCalculation
B64-0601-0000028	Vendor Type for Luxury Tax Report	VendorTypeLuxTaxReport
SR1-0601-0000001	Expected Transaction Header Details Mandatory	ETHDRDTLSCOMPULSARY
SR1-0601-0000002	Expected Transaction Item Details Mandatory	ETITEMDTLSCOMPULSARY
SR1-0601-0000025	Print In Compressed Mode For POS40 Column	PrintCompressedModePOS40Column
SR1-0601-0000027	Service Bill Caption to be Printed	PrintServiceCaptionInBill
SR1-0602-0000012	Show Item Browse Automatically For Matching Stock Nos (Based On Starting Chars Entered)	SKUExtdMatchMethod
SR1-0602-0000014	Search Item Price Factors For Stock No/Item Classification In Billing	SearchRetailPriceCutForSKU
SR1-0602-0000017	Sales Man Selection Mandatory in Billing	SMSelectionCompulsary
SR1-0602-0000021	Default Item Entry Mode in Billing (SKU Wise Or Style,Shade and Size Wise)	DefaultEntryModeInBilling
SR1-0602-0000040	Cut-off Price (MRP) of Item to be Blocked from Billing	CutOffPriceOfItemToBlockBilling
SR1-0602-0000043	Sales Factor Id Used For Quantity Wise Discount Which Can Be Used For Item Spc. Discounts In Billing	QtyDiscIdUsedInBilling
SR1-0602-0000067	Item Details To be Shown In Billing Status Bar	ItemDtlsToShowInStatusBar
SR1-0602-0000078	Bill Printing in Goods Outwards Transaction	BillPrintGORTransaction
SR1-0602-0000079	Print Bill Type as Cash or Reason Code in Goods Outwards	PrnBillTypeCashOrRsnCdGOR
SR1-0602-0000096	Default Search For Item Specific Discounts In Billing	SearchItemSpcDiscounts
SR1-0602-0000102	Delivery Challan Printing Type	DCPrintingType
SR1-0602-0000103	Print SKU Wise or Item Wise	PrnSKUORItemWise
SR1-0602-0000104	Re-Calculate for Sales Tax in Bill Printing	ReCalculateSalesTaxBillPrinting
SR1-0603-0000086	Customer Selection Mandatory in Billing	InBillingCustSelectionCompulsary
SR1-0603-0000087	Additional Transactions Considered For Stock Check Along With Stock Master In Billing/Slips	InBillingTrnsConsideredForStockCheck
SR1-0603-0000113	Whether DC to Print from Invoice	WhetherDCToPrintFromInvoice
SR1-0603-0000114	Whether DC to Print in Compressed Mode	WhetherDcToPrintCompressedMode
SR1-0603-0000115	Caption to Print in Distributor	CaptionPrintDistributor
SR1-0603-0000118	Component Caption to Print in Distributor	CompCaptionPrintDistributor
SR1-0700-0000123	Print Customer Address Remarks and Discount in Bill	PrintDiscCustAddrRmksInPOS
SR1-0701-0000125	Printing Template Folder	PrintingTemplateFolder
SR1-0701-0000126	Default Printing Template File Path	PrintingTemplateDefault
SR1-0701-0000127	Default Printing Control File Path	PrintingTemplateControl
SR1-0701-0000128	Default Printing Conditional File Path	PrintingTemplateCondition
SR1-0701-0000129	Multiple Printing templates Active	PrintingMultipleTemplateActive
SR1-0701-0000130	Temporary folder to write all temp files during generalized printing	GetTmpFilePath
SR1-0701-0000131	No of Copies to be Printed	NoOfCopies
SR1-0701-0000134	Whether to Print Credit Note in Same Page or Not	WhetherPrintCreditNoteSamePageNot
SR1-0701-0000143	Location Of The ConfigFile.INI Used In Bill Printing	ConfigPathFile
SR1-0702-0000001	Auto generate Bill Suspension Number	BillSuspensionDocNoGenOrAccepted
SR1-0702-0000002	Print Bill Suspension	PrintBillSuspension
SR1-0702-0000158	DC Print based on Class1/Class2 or SubClass1/SubClass2	DCPrintOnC1C2OrSC1SC2
SR1-0702-0000159	Bill Prefix Definition Setting	BillPrefixDefSetting
SR1-0702-0000163	Cash Receipt/ Payout Printing Mode	CashRcptPayoutBillFormType
SR1-0702-0000166	Tolerance for Tax Rate in Inward and Outward	ToleranceTaxRate
SR1-0702-0000167	Print Preview	PrintPreview
SR1-0702-0000171	Use Common Prefix for Billing Across All Terminals 	CommonPrefixusedAcrossAllterminals
SR1-0702-0000172	Item Level Net Amt Calculation Requried	ItemLvlNetAmtCalcReq
SR1-0702-0000173	Validation for the Expected Transaction Customer	ValidateETCustomer
SR1-0702-0000174	Validation for the Advance Receipt Customer	ValidateAdvRecpCustomer
SR1-0730-0000181	Validate Quantity and Rate Range in Goods Inwards	ValidateQtyAndRateRangeInGIR
SR1-0730-0000182	Validate Quantity and Rate Range in Goods Outwards	ValidateQtyAndRateRangeInGOR
SR1-0730-0000183	Validate Quantity and Rate Range In Billing	ValidateQtyAndRateRangeInBilling
SR1-0730-0000274	Auto Selection of Discount Code During Item Entry	Autoselectionofdiscountcode
SR1-0730-0000286	Allow reactivation of slips from cancelled bills	AllowReactivationOfSlips
SR1-0730-0000287	Allow deletion of items from recalled documents	AllowDeletionOfItemsFromRecalledDocuments
SR1-0901-0000297	DC Printing in Graphic Printer	DCPrintingInGraphicPrinter
SR1-0901-0000303	Apply Bill Level Discount first	FirstCalculateBillLvlDisc
SR1-0901-0000312	Allow rate Alteration in service billing	AllowRateAlterInServiceBill
SR1-0901-0000315	Expected Transaction-Slip Printing Type	ExpTrnSlipPrintingType
SR1-0901-0000323	DC-Print Header In All Pages	DCPrintHeaderInAllPages
SR2-0600-0000003	Report Name Of The Style Code Delimiter Concept And Key Word Used	StyleCdDelimtRptName
SR2-0600-0000004	Common Style Code Delimiter Indicator Position For All Product Brand Combination	CmnStylDelimIndPos
SR2-0700-0000124	Whether Create TT File For Distributor Or Retail	WhetherCreateTTFileDistributorOrRetail
SR2-0702-0000152	List of Payment Mode Including Franchise Transactions	ListPaymentModeIncludingFranchiseTransaction
SR3-0600-0000020	Caption for Add-ons/ Deductions	CaptionForAddonsDedns
SR3-0600-0000029	PT File Loading From Shoper In-Path	PTFileLoadingFromShoperINPath
SR3-0602-0000046	Whether PT File With Delimeter or Not	WhetherPTFileWithDelimeterorNot
SR3-0602-0000047	Display PT File Delimeter	DisplayPTFileDelimeter
SR3-0602-0000048	Whether PT File Details Taken From Browse or Not	WhetherPTFileDetailsFromBrowseorNot
SR3-0602-0000049	Default Grade Code to be Updated	DefaultGradeCdUpdated
SR3-0602-0000050	Source Tax Type in Inwards	SrcTaxTypeInInwards
SR3-0602-0000051	Valid Transactions in Physical Verification	ValidTrnInPhysicalVerification
SR3-0602-0000052	Apply LSQ in Physical Verification	ApplyLSQinPhysicalVerification
SR3-0602-0000053	Club duplicated items in Physical Verification	ClubDuplicateInPhysicalVerification
SR3-0602-0000069	Retail Price Alteration in Goods Inwards	RetailPriceAlterationInGIR
SR3-0602-0000081	Tolerance Factor In Goods Inwards	ToleranceFactorGIR
SR3-0602-0000082	Whether to Display Stock Discrepancy Report in Goods Inwards	DispStkDisprecancyReportInGIR
SR3-0602-0000083	Reason Code Applicable In Goods Outwards	ReasonCdApplicabilityInGOR
SR3-0602-0000088	Display Computed Stock While Stock Recording	CompStkForPhyStkRecord
SR3-0602-0000089	Display Retail Price & Current Cost	DispMRPCurrCostForPhyStkRecord
SR3-0602-0000090	Physical Stock Taking Commence Status	PhyStkTakingCommenceStatus
SR3-0602-0000091	Physical Stock Taking Scope	PhyStkTakingScope
SR3-0602-0000092	Physical Stock Taking Process	PhyStkTakingProcess
SR3-0602-0000093	Physical Stock Taking Scope ID	PhyStkTakingScopeID
SR3-0602-0000094	Display Column Details in Physical Verification	DispDtlsInPhysicalVerification
SR3-0602-0000100	Whether to Create PT File Based On Invoice or DC	WhetherPTFileBasedOnInvoiceorDC
SR3-0602-0000106	Editing Goods Inwards Document after Day Close	EditGIRDocumentAfterDayClose
SR3-0602-0000107	Disable PT File Loading in Goods Inwards	AllowPTFileLoadingInGIR
SR3-0602-0000108	DC Number Validation Present	DCNoValidationPresent
SR3-0602-0000109	Print DC Detail in Goods Outwards	PrintDCDtlsinGOR
SR3-0602-0000110	Import Goods Inwards into Goods Outwards	ImportGIRIntoGOR
SR3-0700-0000116	Goods Outwards Printing Type	GORPrintingType
SR3-0700-0000117	Goods Inwards Printing Type	GIRPrintingType
SR3-0700-0000119	Whether VAT Invoice or Not in GIR/GOR	WhetherVATInvoiceorNotinGIRGOR
SR3-0700-0000121	Accept Column for VAT Details in GIR/GOR	AcceptColVATDetailsinGIRGOR
SR3-0701-0000131	Rate To Display in Goods Outward - Transfer Out	RateDisplayedInTransferOut
SR3-0701-0000132	Flat File Creation based on PartyId or Company Code	FlatFileCreationBasedPartyIdorCompCd
SR3-0701-0000138	Load PT File Into Other File Option	LoadPTFileIntoOtherOption
SR3-0701-0000141	Allow PDT File Loading in Goods Inwards/Goods Outwards/Physical Verification	AllowPDTFileLoading
SR3-0730-0000223	Purchase Order Stockno,class1cd,class2cd,subclass1cd,subclass2cd,sizecd to Print	POSKUformatatrributeprint
SR3-0730-0000224	Purchase Order Mode of Printing ( 0 inkjet ,1 means dot matrix)	POprintmode
SR3-0730-0000225	PO/Indent SKU Rate ( 1 Retail Price, 2 Dealer Price, 3 Current Cost, 4 Last Purchase Price)	SKUPORateFlag
SR3-0730-0000247	Delete Suspension Details as Part of Day-Begin Process	DelSuspensionInDayBegin
SR3-0730-0000267	Allow PO/Indent Configuration	AllowPOConfig
SR3-0730-0000277	Company Code which has to be recorded in the PT file(s) created.	CompanyCodeforFlatFile
SR3-0730-0000278	Company name which has to be recorded in the PT file(s) created.	CompanyNameforFlatFile
SR3-0730-0000281	Allow Rate Alteration in PO/Indent Conversion	POtoSOConvRateAlter
SR3-0730-0000283	Allow Dealer Price Zero during Pricing Master Import	AllowDealerPriceZeroPMImport
SR3-0730-0000288	PO print margin specification for Laser/inkjet print	POprintmarginGUI
SR3-0730-0000289	Show all pending POs for the selected party in PO browse	ShowAllPendingPosInPOBrowse
SR3-0901-0000299	Purchase Order or Indent is mandatory in Goods Inwards	PurchaseOrderMandatoryInGIR
SR3-0901-0000314	Print Audit Trail Title  in Goods Inwards	PrnAuditTrailTitleInGIR
SR4-0601-0000026	Report Page Length (in Lines)	RPTPrintPageLength
SR4-0601-0000029	Compute Stock Closing Balance on Retail Price / Cost Price	ClsStkValOnMRPCP
SR4-0602-0000022	Show Cash And Card Details In Sales Summary Report	ShowCashAndCardDtlsInSalesSumm
SR4-0602-0000023	Show % Of Sales In Daily Sales Book	ShowPerOfSalesInDailySalesBook
SR4-0602-0000024	Credit Cards Commisionwise Breakup Required In Counterwise Summary ?	CCCommwiseBreakupReq
SR4-0602-0000058	Transcation Types to be used for Stock Ageing Inwards	StkAgingInwardsTrnTypes
SR4-0602-0000059	Transaction Types to be used for Stock Ageing Outwards	StkAgingOutwardsTrnTypes
SR4-0602-0000060	Transaction Types to be used for Sales Ageing	StkAgingSalesTrnTypes
SR4-0602-0000061	Continuation Delimiter Used in Printing Label	LabelPrintContdDelimiter
SR4-0602-0000063	Customer Label Print Configuration	FieldsPrintCustomerLabel
SR4-0602-0000095	Display the Current Stock in Attribute Wise Sale Report	DispCurBalQtyinAttrWiseSalesRep
SR4-0702-0000185	Cost Price Inclusive of Tax	GIRIncTaxForCP
SR4-0702-0000186	Select Price to be displayed in Rate field for Purchase (Cost / Last Purchase Price)	DispCPOrLPPInRateFieldForPurchase
SR4-0702-0000187	Mode of Sales Promotion Applicability in Billing	ModeOfSPAppInBilling
SR4-0730-0000184	List Of Prefixes Blocked In Sales Promotion Catalogue	ListOfPfxsBlockedInSPCat
SR4-0730-0000276	Auto Generate Sales Promotion Code	AutoGenSalesPromoCode
SR4-0730-0000290	Item Description for Style Catalogue	ItemDescSubClass1Cat
SR4-0904-0000001	If Price Revisions Are Applicable, Activate Immediately	PriceRevisionAppRules
SR4-6000-0000008	Whether Sale Tax Percentage depend upon Parameter or SaleTax Catalog	BasedOnParameterorSaleTaxCatalog
SR4-6000-0000009	Sales Tax Percentage For Audit Report(Arvind-VIIB)	SalesTaxPercentageAuditReport
SR4-6000-0000054	List Of Class2Cds which belongs to Gift Voucher Report	GetGVRClass2Cds
SR4-9111-0000333	Catalogue – For Item Level Fixed Discounts/Offers – Default behaviour for Lowest/Highest Priced Item	LowestHighestPricedItem
SR5-0600-0000010	AST Export Based On Date Or VaCtr	ASTExportBasedOnDateOrVactr
SR5-0600-0000013	Sleep Timer Set For AST Import	ASTImportSetSleepTimer
SR5-0600-0000018	Export Entire StockTrnSummary For IM	ExportEntireStkTrnSummaryForIM
SR5-0600-0000019	Update Patch Date & Release Number	UpdtPatchDtReleaseNo
SR5-0601-0000006	IM Flat File Creation Date	IMFileCreationDate
SR5-0601-0000007	Check IM File Date Updated In IM File Or Send Flat File To Ho	CheckIMFileToUpdated
SR5-0601-0000011	During IM-ID File Creation Skipped Record or Default Record	CheckIMFileSkippedOrDefaultRecord
SR5-0601-0000016	Tally Accounting Interface Generation Number	TallyInterfaceGenerationNumber
SR5-0602-0000017	Walk-in - Extended Information	WalkinExtendedInformation
SR5-0602-0000041	Update Tax Automatically in Pricing Master Import	PMImportAutoTaxUpdation
SR5-0602-0000042	Franchisee Checks During Day End	FranchCheckForDayEnd
SR5-0602-0000044	Allow Day Open Date	AllowDayOpenDate
SR5-0602-0000045	Allow POS Payment Modes Modification Date For Other Dates	AllPOSPaymentModeModifyForOthDates
SR5-0602-0000065	Year Ending Month	YearEndMonthNo
SR5-0602-0000066	Update Sysparam and Genlookup Counter During Day End	UpdateSysparamGenlookupCtrDayEnd
SR5-0602-0000070	Print Details of Customer Label Line#1	CustLblLine1Font
SR5-0602-0000071	Print Details of Customer Label Line#2	CustLblLine2Font
SR5-0602-0000072	Print Details of Customer Label Line#3	CustLblLine3Font
SR5-0602-0000073	Print Details of Customer Label Line#4	CustLblLine4Font
SR5-0602-0000074	Print Details of Customer Label Line#5	CustLblLine5Font
SR5-0602-0000075	Print Details of Customer Label Line#6	CustLblLine6Font
SR5-0602-0000076	Print Details of Customer Label Line#7	CustLblLine7Font
SR5-0602-0000077	Print Details of Customer Label Line#8	CustLblLine8Font
SR5-0602-0000084	Franchisee Checks Applicable During Day End	FranchCheckApplicableInDayEnd
SR5-0602-0000101	Option For Conversion Of Sale DC To Approval DC In Day End	SalesDcConvGraceDays
SR5-0602-0000105	Additional Columns Exist for General Price Revision	AddlColsExistForGenPriceRev
SR5-0602-0000111	Validate Against MOP Vs Current Stock Qty	ValidateMOPVsCurrentStkQty
SR5-0701-0000130	Flat File Creation in App Path Out or DBOut Directory	FlatFileCreationAppPathOutShareDir
SR5-0701-0000133	Whether to display Customer Code or Name in Tally	WhetherCdOrNameinTally
SR5-0701-0000135	Convert Negative Stock to Misc. Receipt	ConvertNegStkToMiscRcpt
SR5-0701-0000136	Whether to display Alias for Account Name in Tally	WhetherAliasOrNotInTally
SR5-0701-0000137	PM Import and GIR - Update TAX automatically	DefaultTaxInclusiveUpdateInPMGIR
SR5-0701-0000139	Tolerance Factor In Day Begin for Qty And Value	ToleranceFactorDayBeginQtyValue
SR5-0701-0000140	Enable Common PT File Creation	CommonPTFileCreationEnabled
SR5-0702-0000145	AST Export Path	ASTExportPath
SR5-0702-0000146	AST Import Path	ASTImportPath
SR5-0702-0000147	AST BackUp Path	ASTBackUpPath
SR5-0702-0000148	AST DSN Name	ASTDSNName
SR5-0702-0000149	Tables to be excluded during export to replication1	TempTableToSkipFromAST1
SR5-0702-0000150	Tables to be excluded during export to replication2	TempTableToSkipFromAST2
SR5-0702-0000153	Tally IP Address	TallyIPAddress
SR5-0702-0000154	Tally Company Name	TallyCompanyName
SR5-0702-0000155	Tally Port No	TallyPortNo
SR5-0702-0000156	Option to Export Sales Transaction to Tally	OptionExportSalesTransTally
SR5-0702-0000157	Actual Quantity in Flat File Creation	MoveActualQtyInFlatFile
SR5-0702-0000160	FTP Remote Path For Uploading the Files	FFileFTPREMOTESENDPATH
SR5-0702-0000161	FTP IS Passive mode	FFileFTPPASSIVEMODE
SR5-0702-0000164	Flat File Party Code Based on Franchise Code	InFlatFilePartyCdBasedOnFranchCdOrCompCd
SR5-0702-0000168	Export Entire Stock Transaction Summary in Day End Process	ExportEntireStkTrnSummaryForDayEnd
SR5-0702-0000170	No. of Days Backup to be Preserved	NoOfDaysBackupToBePreserved
SR5-0730-0000188	Print To Address in  Goods Inwards	PrintToAddressGIR
SR5-0730-0000189	Loading / Storing Path for Barcode Design Templates	PathBarcodeDesignTemplates
SR5-0730-0000190	Display Actual Quantity and Doc Quantity for PO Pre-fill	DispActQtyDocQtyForPOPrefill
SR5-0730-0000191	Split Quantity If Actual Qty is More than PO Qty	SplitActQtyIfMoreThanPOQty
SR5-0730-0000192	Auto Pre-fill PO details in Goods Inwards (Only for POs based on stock number)	PrefillPODetailsInGIR
SR5-0730-0000193	Re Open PO when GIR Document Edited or Deleted If PO is Closed	ReOpenPOWhenGIREditOrDelete
SR5-0730-0000194	Validate Flat File PO Ref. with POS PO Ref.	ValidateFlatFilePORefInGIR
SR5-0730-0000195	Validate Data during Pricing Master Import	ValidateDataDuringPMImport
SR5-0730-0000226	Running No for Data Extract Transaction File	RunNoDataExtract
SR5-0730-0000227	Wait Time for Data Extraction Before Data Polling	ExtractDataWaitTime
SR5-0730-0000228	Flat File thru On Line	SendFFThruOnLine
SR5-0730-0000229	Server Name for On Line Data Sync	FFileOnLineServer
SR5-0730-0000230	Subject Line for POS generated Mails to HO	FFileMailSubjectHO
SR5-0730-0000231	Subject Line of Mails to be Downloaded at POS	FFileMailSubjectPOS
SR5-0730-0000232	Subject Line of Mail Acknowledgement From HO	FFileMailAckSubjectHO
SR5-0730-0000233	Message for Mail From HO	FFileMessageHO
SR5-0730-0000234	Message for Mail From POS	FFileMessagePOS
SR5-0730-0000235	Message for Mail Ack From HO	FFileMessageAckHO
SR5-0730-0000236	File Type for Downloading at HO	FFileTypeDownHO
SR5-0730-0000237	File Type for Downloading at POS	FFileTypeDownPOS
SR5-0730-0000238	Stock Visibility Browse Description String Formation - 1	SVBrowseDescString1
SR5-0730-0000239	Stock Visibility Browse Description String Formation - 2	SVBrowseDescString2
SR5-0730-0000240	Display Current Quantity in Stock Visibility Browse	SVDisplayCurQtyInBrowse
SR5-0730-0000241	Maximum Rows in Stock Visibility Browse	SVBrowseMaxRows
SR5-0730-0000242	Default Sorting Order in Stock Visibility Browse	SVDefaultSortingOrderFieldInIB
SR5-0730-0000243	Code And Desc Order For Classfn Fields Displayed in Stock Visibility Browse	SVShowCodeAndDescOrderInIB
SR5-0730-0000244	Delimiter Character for Code and Description Display in Stock Visibility Browse	SVDelimitCharForCodeDescInIB
SR5-0730-0000245	Default Searching Field(CodeOrDesc) in Stock Visibility Browse	SVDefaultSearchFldInClassiBrowse
SR5-0730-0000246	Additional Tables to be Included During Sync.	AdlTablesToSync
SR5-0730-0000248	Connection Time Out in Seconds	ConnectionTimeOut
SR5-0730-0000249	Command Time Out in Seconds	CommandTimeOut
SR5-0730-0000250	Database Version	DBVersion
SR5-0730-0000251	TCP Version	TCPVersion
SR5-0730-0000252	Purchase Order Printint format	POPrintFormat
SR5-0730-0000253	Upload Folder for FTP	FFileFTPUpFolder
SR5-0730-0000254	Download Folder for FTP	FFileFTPDownFolder
SR5-0730-0000255	DialUp Check for FTP	FFileFTPDialUpCheck
SR5-0730-0000256	Upload Folder for Direct Copy	FFileDCopyUpFolder
SR5-0730-0000257	Download Folder for Direct Copy	FFileDCopyDownFolder
SR5-0730-0000258	HO Email Id	FFileEmailId
SR5-0730-0000259	File Type for HO	FFileTypeHO
SR5-0730-0000260	File Type for POS	FFileTypePOS
SR5-0730-0000261	Subject for Resync Request From HO	FFileMailResyncSubjectHO
SR5-0730-0000262	Message for Resync Request From HO	FFileMessageResyncHO
SR5-0730-0000263	Shoper Temporary Backup Path	BackupPath
SR5-0730-0000264	Default Size Group Id	DefaultSizeGroupId
SR5-0730-0000265	Free Items Mandatory in Billing	ValidateFreeItemsInBill
SR5-0730-0000266	Free Items Billed at Value	FreeItemsBillAt
SR5-0730-0000267	Number of digits to be Stored in credit card number	NoDigitStoredinCreditCardNo
SR5-0730-0000268	Print Audit Trail Title  in Goods Outwards	PrnAuditTrailTitleInGOR
SR5-0730-0000269	Print Tax Component Name and Description In VAT Summary	PrintTaxComponentNmDescInVATSummary
SR5-0730-0000270	File Upload/download Retrying times	Fileuploaddownloadretrytimes
SR5-0730-0000271	File Upload/download Retrying Delay interval seconds	Fileuploaddownloadretryinterval
SR5-0730-0000272	Print Tax Type Description in VAT Summary	PrintTaxTypeDescInVATSummary
SR5-0730-0000273	Allow SKU Rate Alteration in PO/Indent	SKUPORateAlter
SR5-0730-0000275	Automatic Retain only Last n months for Data Archival	AutomaticRetainOnlyLastNMonthDataArchival
SR5-0730-0000279	Extended Data Input Mode	ExtendedDataInputMode
SR5-0730-0000280	Apply PO Rate with PO Reference in Inwards	ApplyPORateWithPORefInGIR
SR5-0730-0000282	Extraction Zip file split size specification in KB	Extractzipsplitsize
SR5-0730-0000285	DBVersion to be updated for POS Transactions	DBVersionUpdtInPOS
SR5-0730-0000291	Shoper Live Update Backup Parameter	LUBackupParam
SR5-0901-0000298	Path to move file after processing	ProcessedFilePath
SR5-0901-0000300	DISPLAY NET AVALIABLE QUANTITY IN ITEM BROWSE FOR BILLING	DISPLAYNETQTYINBROWSE
SR5-0901-0000302	Post Cost Center information to tally	PostCCToTally
SR5-0901-0000310	Create detailed log file in tally mapping	TallyLogType
SR6-0601-0000015	Customer Code Generation Format	CustomerCdGenerationFormat
SR6-0601-0000017	Cut-Off Quantity For Excess Stock Handling	ExcStkHandlingCutOffQty
SR6-0601-0000018	Conversion Factor For Excess Stock Handling	ExcStkConvFactor
SR6-0601-0000019	Print Counter Summary Report	PrintCounterSummRpt
SR6-0602-0000055	Display SubClass1 and SubClass2 Description in Item Master Entry	DispSubClass12Desc
SR6-0602-0000056	Configure Display of Analysis Code in Item Master Entry	DispCodeDescOrBothForAnalCode
SR6-0602-0000057	Display Common Field in top or Spread  in Item Master Entry	DispCommonFldTopOrSpread
SR6-0602-0000062	Activate the Multiple Selection in Customer Browse	ActivateMulSelectCustomerBrowse
SR6-0602-0000064	Order By Class Code for Goods Register	OrderByC2C1ForGoodsReg
SR6-0602-0000068	Accept Document Remarks in Bill	AcceptDocRemarksInBilling
SR6-0602-0000080	Image Applicable at Style or SKU level	PMImageHeirarchyLevel
SR6-0602-0000112	StockNo used for Handling Bill Jumping	SKUforHandlingBillJump
SR6-0701-0000142	Item Master Creation - (1) Record By Record Insertion Or (0) Bulk Insert	InsertStockNoLineItemLevel
SR6-0702-0000144	Accept Quantity in Item Master Entry	AcceptQtyInItemMasterEntry
SR6-0702-0000151	Sales Factor Rec. Id Auto Generation	SalesFactorRecIdAutoGen
SR6-0702-0000162	Image ID Applicable in Item Master	ImageIDPresentInItemmaster
SR6-0702-0000165	Shoper Image File Path	ShoperImageFilePath
SR6-0702-000143A	Batch SrlNo For Item Master Entry	BatchSrlNoA
SR6-0702-000143B	Batch SrlNo Rec-Id For Item Master Entry	BatchSrlNoB
SR6-0702-000144A	Regular Indicator for ItemMaster Entry	RegIndA
SR6-0702-000144B	Regular Indicator Rec-Id for ItemMaster Entry	RegIndB
SR6-0730-0000175	Allowed Operations in Size Catalogue Management	OperationsAllowedInSizeCatManage
SR6-0730-0000284	If Sales Promotions are Applicable to New Items Created, Activate Immediately	ActivateSalesPromosToNewItems
SR6-0730-000196A	Item Analysis Code6 Present	ItemAnaCd6Present
SR6-0730-000196B	Item Analysis Code6 Caption	ItemAnaCd6Caption
SR6-0730-000196C	Item Analysis Code6 Look-up Rec Id	ItemAnaCd6RecId
SR6-0730-000197A	Item Analysis Code7 Present	ItemAnaCd7Present
SR6-0730-000197B	Item Analysis Code7 Caption	ItemAnaCd7Caption
SR6-0730-000197C	Item Analysis Code7 Look-up Rec Id	ItemAnaCd7RecId
SR6-0730-000198A	Item Analysis Code8 Present	ItemAnaCd8Present
SR6-0730-000198B	Item Analysis Code8 Caption	ItemAnaCd8Caption
SR6-0730-000198C	Item Analysis Code8 Look-up Rec Id	ItemAnaCd8RecId
SR6-0730-000199A	Item Analysis Code9 Present	ItemAnaCd9Present
SR6-0730-000199B	Item Analysis Code9 Caption	ItemAnaCd9Caption
SR6-0730-000199C	Item Analysis Code9 Look-up Rec Id	ItemAnaCd9RecId
SR6-0730-000200A	Item Analysis Code10 Present	ItemAnaCd10Present
SR6-0730-000200B	Item Analysis Code10 Caption	ItemAnaCd10Caption
SR6-0730-000200C	Item Analysis Code10 Look-up Rec Id	ItemAnaCd10RecId
SR6-0730-000201A	Item Analysis Code11 Present	ItemAnaCd11Present
SR6-0730-000201B	Item Analysis Code11 Caption	ItemAnaCd11Caption
